{
  "schema_version": "1.0",
  "dag_id": "cyc_demo",
  "dag_version": "v0.1.2-13-g56ad13b-dirty",
  "image": "",
  "tasks": [
    {
      "task_id": "a",
      "type": "bash",
      "depends_on": [
        "c"
      ],
      "entrypoint": "echo a"
    },
    {
      "task_id": "b",
      "type": "bash",
      "depends_on": [
        "a"
      ],
      "entrypoint": "echo b"
    },
    {
      "task_id": "c",
      "type": "bash",
      "depends_on": [
        "b"
      ],
      "entrypoint": "echo c"
    }
  ],
  "owner": "examples",
  "tags": [
    "example"
  ]
}